{
  "schemaVersion": 1,
  "storySlug": "an-agents-context-window-is-a-data-boundary",
  "operation": "import_to_private_draft",
  "topics": ["AI Agents", "Data Governance", "Privacy", "RAG", "Enterprise Architecture"],
  "canonicalUrl": "https://singhaditya21.github.io/Medium/articles/an-agents-context-window-is-a-data-boundary/",
  "publication": null,
  "subscriberEmail": false,
  "paywall": false,
  "scheduleAt": null,
  "humanReviewRequired": true,
  "requiresFinalConfirmation": true,
  "allowUnattendedPublish": false
}
