{
  "schemaVersion": 1,
  "storySlug": "your-ai-agent-needs-a-transaction-boundary",
  "operation": "import_to_private_draft",
  "topics": ["AI Agents", "Distributed Systems", "Transactions", "Enterprise Architecture", "Reliability"],
  "canonicalUrl": "https://singhaditya21.github.io/Medium/articles/your-ai-agent-needs-a-transaction-boundary/",
  "publication": null,
  "subscriberEmail": false,
  "paywall": false,
  "scheduleAt": null,
  "humanReviewRequired": true,
  "requiresFinalConfirmation": true,
  "allowUnattendedPublish": false
}
