{
  "schemaVersion": 1,
  "storySlug": "model-routing-is-capital-allocation",
  "operation": "import_to_private_draft",
  "topics": [
    "AI Agents",
    "Model Routing",
    "AI Economics",
    "FinOps",
    "Enterprise AI"
  ],
  "canonicalUrl": "https://singhaditya21.github.io/Medium/articles/model-routing-is-capital-allocation/",
  "publication": null,
  "subscriberEmail": false,
  "paywall": false,
  "scheduleAt": null,
  "humanReviewRequired": true,
  "requiresFinalConfirmation": true,
  "allowUnattendedPublish": false
}
