{
  "schemaVersion": 1,
  "storySlug": "ai-agent-observability-is-not-logging",
  "operation": "import_to_private_draft",
  "topics": ["AI Agents", "Observability", "OpenTelemetry", "Enterprise Architecture", "Reliability"],
  "canonicalUrl": "https://singhaditya21.github.io/Medium/articles/ai-agent-observability-is-not-logging/",
  "publication": null,
  "subscriberEmail": false,
  "paywall": false,
  "scheduleAt": null,
  "humanReviewRequired": true,
  "requiresFinalConfirmation": true,
  "allowUnattendedPublish": false
}
